<?xml version="1.0" encoding="UTF-8"?>
<xs:schema xmlns:xs="http://www.w3.org/2001/XMLSchema"
           xmlns:prox="http://github.com/tfreese/proxy-config"
           targetNamespace="http://github.com/tfreese/proxy-config"
           attributeFormDefault="unqualified"
           elementFormDefault="qualified"
>

    <xs:element name="proxy-config">
        <xs:complexType>
            <xs:sequence>
                <xs:element name="port" type="xs:positiveInteger" />
                <xs:element name="repositories" type="prox:repositories" />
                <xs:element name="file-cache" type="prox:fileCache" minOccurs="0" />
                <xs:element name="db-monitoring" type="prox:dbMonitoring" minOccurs="0" />
            </xs:sequence>
        </xs:complexType>
    </xs:element>

    <xs:simpleType name="httpUri">
        <xs:restriction base="xs:anyURI">
            <xs:pattern value="http:.*" />
            <xs:pattern value="https:.*" />
        </xs:restriction>
    </xs:simpleType>

    <xs:complexType name="repositories">
        <xs:sequence>
            <xs:element name="url" type="prox:httpUri" maxOccurs="unbounded" />
        </xs:sequence>
    </xs:complexType>

    <xs:complexType name="fileCache">
        <xs:sequence>
            <xs:element name="enabled" type="xs:boolean" default="false" />
            <xs:element name="path" type="xs:string" />
        </xs:sequence>
    </xs:complexType>

    <xs:complexType name="dbMonitoring">
        <xs:sequence>
            <xs:element name="enabled" type="xs:boolean" default="true" />
            <xs:element name="jdbc-url" type="xs:string" />
        </xs:sequence>
    </xs:complexType>

</xs:schema>
